product,pic,shippingstatus,mono_inputs,stereo_inputs,density,cv_panning,cv_vcas,mutesolo,sends,indiv_outs,headphone,price,notes,_mgurl,_website,_hp,_year
Product,,Shipping,Mono Inputs,Stereo Inputs,Channel Density/HP,CV Panning,CV VCAs,Mute/Solo,Sends,Individual Outs,Headphone Out,Approx. Price (USD),Additional Notes,,,,
1010music Bluebox Eurorack Edition,1010-bluebox-euro.jpg,Yes,0-12,0-6,40%,up to 6,up to 6,full mute/solo/cue for all tracks,four configurable outputs,four configurable outputs,Yes,$700,midi control support; built-in effects; EQ; six assignable CV inputs; multitrack recording with multiple takes; USB audio I/O; audio playback; master compressor,https://www.modulargrid.net/e/1010-music-bluebox-,https://1010music.com/product/bluebox-eurorack,30,2023
ADDAC Stereo Summing Mixer,addac-stereo-summing-mixer.jpg,Yes,1-5+,1-5+,6%,5,5,5 (manual),3 stereo sends,pre- or post-fader (switched per channel),Yes,$1350,"product is broken into two modules, one for I/O and one for control; expander adds four more fully-featured channels, and you can add as many of these as you like; additional expanders add more individual channel outputs;  cueing system; extensive line level support",https://www.modulargrid.net/e/addac-system-addac807a,http://www.addacsystem.com/product/addac800-series/addac807,80,2017
After Later Audio Bartender,after-later-bartender.jpg,Yes,0-4,0-4,17%,4,4,4 (manual),"2 stereo sends, 2 stereo returns",,Yes,TBD,each channel can be stereo or mono; cue system; expander can add two more channels,https://www.modulargrid.net/e/after-later-audio-bartender,,24,2023
ALM Busy Circuits Mega Tang,alm-mega-tang.jpg,Yes,4,,25%,0,4,"4 (manual, clickless)","1 mono send, 1 stereo return",4,No,$299,patching an individual channel output removes it from the stereo mix; additional channels or sends available with expanders,https://www.modulargrid.net/e/alm-busy-circuits-mega-tang,https://busycircuits.com/alm033/,16,2022
Animal Factory Tannhauser Gates,animal-factory-tannhauser.jpg,Yes,4,1 stereo aux input,20%,0,4, 4 (manual),1 stereo send,4,No,$400,overdrive; master VCA; tilt EQ per channel; multiple units can be chained,https://www.modulargrid.net/e/animal-factory-amplification-tannhaeuser-gates,https://animalfactoryamps.com/collections/eurorack-modules/products/eurorack-tannhauser-gates,20,2023
Audio Gear Obsession SUMMINGFACILITY,ago-summingfacility.jpg,Yes,6,aux returns can act as a stereo input,16%,0,0,"6 mutes (manual), 6 send mutes (manual)",2,,No,$1000,extra headroom; extra gain available for working with line level inputs; balanced i/o; expanders planned,https://www.modulargrid.net/e/other-unknown-summingfacility-,https://audiogearobsession.com,38,2019
Befaco HEXA,befaco-hexmix.jpg,Yes,6,3 stereo returns,9%,0,6,6 (manual),3 mono sends,post-EQ/fader,Yes,$1200,product is broken into three modules; per-channel and master EQ features; cueing system; LED VU meters for master mix,https://www.modulargrid.net/e/befaco-hex-mix,https://www.befaco.org/en/hexmix/,70,2017
blaknblu Alpha Pro,blaknblu-alpha-pro.jpg,Yes,4,0,11%,4,4,,0,,No,$490,dual mix buses;zero crossing detection for clickless enveloping; overdrive features;switchable AC/DC coupling,https://www.modulargrid.net/e/other-unknown-alpha-pro,http://www.blaknblu.com/,38,2024
Boredbrain Xcelon,boredbrain-xcelon.jpg,Yes,0-6 plus two mono/stereo returns,0-6 plus two mono/stereo returns,13%,6,6,6 (manual),2 stereo sends,balanced pre- or post-fader (optional expander required),No,$900,"each channel can be mono, stereo, or dual mono with a crossfader; two separate mix buses; level and CV over stereo aux returns; channel peaking and level LEDs; various expanders and related modules can be combined with the Xcelon",https://www.modulargrid.net/e/boredbrain-music-xcelon,http://www.boredbrainmusic.com/product/xcelon,48,2023
Centrevillage Cerasus Mixer,centreville-cerasus.jpg,Yes,3,2,42%,2,4,5 (manual),,No,No,$400,digitally-controlled analog mixer; two stereo buses; envelope follower and built-in ducking/accent capability; limiter feature (derived or external source); trim/gain; selectable pan law; multiple units can be chained to add channels,https://modulargrid.net/e/centrevillage-cerasus-mixer,https://centrevillage.net/products/25,12,2024
Clank Endline,clank-endline.jpg,Yes,0-6,0-4 + 2 stereo returns,40%,0,0,0,2 mono or 1 stereo,No,Yes,$450,special accommodations for integrating guitar pedals into send/return;submixer section ,https://modulargrid.net/e/clank-endline,https://www.clank.eu/endline,10,2024
Cosmotronic Cosmix Pro,cosmotronic-cosmix-pro.jpg,Yes,4-6,0-2,27%,2,0,6 (manual),"1 mono send, 1 stereo send",No,No,$470,low cut and gain switches for certain channels; led level meters; can be daisy-chained behind the panel,https://www.modulargrid.net/e/cosmotronic-cosmix-pro,,22,2022
Cre8audio Assembler,cre8audio-assembler.jpg,Yes,6,2,20%,,,11 (manual),3 mono,No,Yes,$350,EQ on channels 1 and 2; cue feature; gain boost feature for line to modular levels,https://modulargrid.net/e/cre8audio-assembler,https://www.cre8audio.com/assembler,40,2025
Cwejman MX-4S,mx4s.jpg,Yes,4,0,20%,4,4,0,0,,No,$900,cv over master level; LED VU meters for master mix,https://www.modulargrid.net/e/cwejman-mx-4s,http://www.cwejman.net/mx-4s.htm,20,2012
Doepfer A-135-3,doepfer-a-135-3.jpg,Yes,0,4,50%,0,4,0,,,No,$349,,https://www.modulargrid.net/e/doepfer-a-135-3,,8,2020
Doepfer A-135-4A/B/A-138o,doepfer-A135.jpg,Yes,4,0,13%,4,4,4 (cv),4,,No,$440,expandable up to sixteen channels; can be mixed/matched with A-138 modules; per-channel gain; envelope follower expander,https://www.modulargrid.net/e/doepfer-a-135-4a,http://www.doepfer.de/home_e.htm,30,2017
Dreadbox Psychosis,dreadbox-psychosis.jpg,Yes,0-6,0-3,30%,1 (sort of),0,0,0,0,No,$199,"cv controllable stereo spread (and inversion) with build-in LFO for swirly effects; four built-in stereo effects (reverb, delay, and two choruses); primarily designed to mix down multiples of the Dreadbox Telepathy voice module",https://www.modulargrid.net/e/dreadbox-psychosis,https://www.dreadbox-fx.com/psychosis/,10,2023
Endorphin.es Cockpit 2,endorphines-cockpit-2.jpg,Yes,0-4,0-4,67%,0,0,4 (manual),0,,Yes (but not dedicated),$200,"each channel can be mono (TR) or stereo (TRS) based upon jumpers; multiple Cockpit 2 modules can be daisychained with jumpers behind the panel; built in ducking circuit based on CV, audio, or triggers",https://www.modulargrid.net/e/endorphin-es-cockpit-2,https://endorphin.es/portfolio-items/cockpit-2/,6,2020
Entineering Mixer,entineering-mixer.jpg,Yes,0-3,0-3,30%,0,0,0,0,0,No,$222,MIDI controllable via program change or CC; 99 state save slots; toggle between two states with CV,https://modulargrid.net/e/entineering-mixer,https://shop.entineering.eu/product/entineering-mixer-429842,10,2024
Eowave Supamix,eowave-supamix.jpg,Yes,4-6,0-2,60%,2,0,"6 mutes (manual), plus various CV-triggered mute behaviors",,,No (but available on expander),$300,"additional stereo input, line out, and headphone out available with expander; TRS stereo output available via jumper setting",https://www.modulargrid.net/e/eowave-supamix,https://www.alex4.de/component/zoo/item/eowave-supamix,10,2023
Erica Synths Black Output v2,erica-black-output-v2.jpg,Yes,3,1,29%,1,0,0,0,,Yes,$290,,https://www.modulargrid.net/e/erica-synths-black-output-module,https://www.ericasynths.lv/shop/eurorack-modules/by-series/black-series/black-output-v2/,14,2018
Erica Synths Stereo Mixer v2,erica-stereo-mixer2.jpg,Yes,1,3,40%,1,0,0,0,,No,$145,Pre-fade Listen Expander available adds headphone output and cueing,https://www.modulargrid.net/e/erica-synths-black-stereo-mixer-v2,http://www.ericasynths.lv/en/shop/eurorack-modules/by-functions/mixers/black-stereo-mixer/,10,2017
Feedback Mix BX/CR/KM,feedback-mix-bx.jpg,Yes,6,2 stereo returns,23%,0,0,6 (manual),2,,Yes,$300,Hi/Lo EQ per channel; three circuit designs available (different coloration),https://www.modulargrid.net/e/feedback-mix-bx,https://www.feedbackmodules.com/products/mix-bx,35,2021
Frap Tools CGM,frapcgm-updated-2.jpg,Yes,3+,3+,8%,3+,3+,3+ (manual),2+,pre- or post-fader (switched per channel),Yes,$1100,unique expandable modular design (picture shows only one possible combo); extensive VCA support on everything; solo functionality (requires Group module); pre-fader cueing (requires Master module); LED VU meters for master mix (Master module); 2021 update adds multiple balanced output stage,https://www.modulargrid.net/e/modules/browser?SearchName=cgm,http://frap.tools/portfolio/mixer/,36,2016
Frap Tools QSC,frap-qsc.jpg,Yes,0-8,0-4,22%,2,4,4 (manual),2,,No,$500,"can be used standalone or as part of the CGM mixer system; nominally 4 stereo channels, but stereo inputs can be treated as dual mono, with crossfading functionality",https://www.modulargrid.net/e/frap-tools-qsc-quad-stereo-channel,https://frap.tools/products/mixer/,18,2020
Frequency Central Strips,freq-central-strips.jpg,Yes,4,1 stereo AUX return,20%,,4,4 (manual),1,,,$320,high and low eq; scribble strips; two units can be chained,https://www.modulargrid.net/e/frequency-central-strips,https://frequencycentral.co.uk/product/strips-4-channel-vca-mixer/,20,2024
Happy Nerding Panmix,happy-nerding-panmix.jpg,Yes,4-6 (switches on back),0-2 (switches on back),38%,0-6,0-6,0,0,,Yes (sort of),$300,LED VU meters for master mix; headphones and main outputs share one attenuator; inputs 3 and 6 can accept stereo mini jacks depending on switches on back of panel;can be daisy chained with other Happy Nerding stereo modules,https://www.modulargrid.net/e/happy-nerding-panmix,http://www.happynerding.com/category/panmix/,16,2016
Instruo cárn,instruo_carn.jpg,Yes,4,0,50%,1,1 (plus 1 for master outs),,individual outs can be used for parallel processing,4,No,$380,"can be daisy chained behind the panel (cable included); switchable ac coupling; switchable normaling; switchable limiter; each channel has a special feature, some with CV control; master VCA",https://www.modulargrid.net/e/instruo-carn,https://www.instruomodular.com/product/carn/,8,2022
Intellijel Dubmix,dubmix.jpg,Discontinued,4,1 stereo aux input (2 more with expander),14%,4,4 (but requires expander for use),4 (manual),"1 mono send, 1 stereo return; additional sends with expander",,No,$600,expanders add two more aux sends and/or CV control over channel levels; elaborated AUX send architecture (see docs); LED VU meters for master mix,https://www.modulargrid.net/e/intellijel-dubmix,https://intellijel.com/eurorack-modules/dubmix/,28,2018
Jolin Tutto & Sempre,jolin-tutto-sempre.jpg,Yes,0,4 plus 2 aux in,35%,0,4,4 (manual),4 inserts,4 post-fader/VCA,Yes (2 independent),TBD (DIY),balanced outs,https://www.modulargrid.net/e/jolin-tutto-sempre,https://jolin.tech/tuttoesempre,20,2023
Koma Elektronik Poltergeist,poltergeist2.jpg,Discontinued,4,1 aux in,14%,4,"4, plus master",4 (manual),0,,No,$800,elaborated stereo or quad panning features; compression feature; self-patching-oriented design,https://www.modulargrid.net/e/koma-elektronik-poltergeist,http://koma-elektronik.com/?product=poltergeist-quadraphonic-audio-mixer-panner-vca,28,2013
L-1 Discreet VC Stereo Mixer,l-1-discrete-vc-stereo-mixer.jpg,Yes (DIY or pre-built),0,4,18%,4,4,0,0,,No,$600,master level cv; LED VU meters for master mix; mute expander; insert expander,https://www.modulargrid.net/e/l-1-discrete-vc-stereo-mixer,,22,2019
L-1 Two Channel Voltage Controlled Stereo Mixer.,l-1-2-channel.jpg,Yes (DIY or pre-built),1-2,1-2,14%,2,4,0,2 stereo sends; no returns,,0,$115,LED VU meters; full CV over level and pan (but not the SEND),https://www.modulargrid.net/e/l-1-2-channel-vc-stereo-mixer,http://l-1.su/2chStereoMixer.html,14,2016
L-1 VC Stereo Mixer,vcstereomixer.jpg,Yes (DIY or pre-built),4,0,18%,4,4,0,0,,Yes (sort of),$155,master level cv; LED VU meters for master mix,https://www.modulargrid.net/e/l-1-vc-stereo-mixer,http://l-1.su/StereoMixer.html,22,2013
Modbap Modular Transit,modbap-transit.jpg,Yes,0-2,0-2,33%,,(see notes),2 (manual),,,Yes,$250,Each channel has a ducking VCA with input jack; level LEDs,https://www.modulargrid.net/e/modbap-modular-transit,https://www.modbap.com/products/transit,6,2022
NANO Modules Performance Mixer,nano-pm.jpg,Yes,2,2,14%,4,4,4,2,4 stereo (post-fader) with expander,Yes,$640,"cue system; clickless mutes; motion recording/looping for level, pan and send; expander adds cv control over mute, post-fader stereo channel outputs and cv over aux for the stereo channels",https://www.modulargrid.net/e/nano-modules-performance-mixer,https://nano-modules.com/performance-mixer/,28,2023
NANO Modules ST-MAR,nano-st-mar.jpg,Yes,0-3,0-3,38%,0,3,3 (manual),0,,No,$150,master attenuator; clip and signal LEDs,https://www.modulargrid.net/e/nano-modules-st-mar,https://nano-modules.com/stmar/,8,2023
Noise Engineering Xer Mixa,ne-xer-mixa.jpg,Yes,0-10,0-10,31%,10,10,10,2 stereo sends,No,No,$1050,clickless mutes; three stereo buses; digital channel configuration with eight save slots (fully analog audio path); cv control expanders,,https://noiseengineering.us/products/xer-mixa-expando-expandi?color=black,32,2023
NoisyFruitsLab 8CHAN,noisyfruits-8chan.jpg,Yes,8,0-2,26%,,,,2,DIY,No,$470,"LED VU meters for master mix; per channel gain; stereo aux in; separate level control over sends, returns, and master; headers for DIY direct out and cue out expanders",https://www.modulargrid.net/e/noisyfruitslab-8chan,https://noisyfruitslab.com/2022/07/13/8chan-m-8-channel-stereo-mixer-for-eurorack-synthesizer/,42,2022
OIIIAUDIO Quad Mixer,OIII-quad-mixer.jpg,Yes,4,0,17%,4,0,0,0,,Yes,$350,,https://www.modulargrid.net/e/other-unknown-oiiiaudio-quad-mixer-with-controlled-panorama,http://o3audio.com/shop/quad-mixer-with-a-controlled-panorama/,24,2019
ProModular MIIIIX,miiiix.jpg,Discontinued,4,0,22%,4,4,4 (manual),Expander,post-fader,Yes (sort of),$600,"expanders add AUX send/returns, cv control over mute/solo and other features; up to four MIIIX can be chained for up to 16 total channels; extra output configuration options",https://www.modulargrid.net/e/promodular-miiiix-,http://www.pro-modular.com/miiiix-insert-commander-master.html,18,2014
Qu-Bit Mixology,mixology-final.jpg,Yes,4,1 stereo AUX return,14%,4,4,4/4 (manual),1,,No,$400,LED VU meters for master mix,https://www.modulargrid.net/e/qu-bit-electronix-mixology,http://www.qubitelectronix.com/modules/mixology,28,2017
Roland SYSTEM-500 531 MIX,roland-531.jpg,Yes,4-6,0-1,30%,6,0,6 (manual),0,,Yes,$400,"stereo preamp with 1/4"" jack",https://www.modulargrid.net/e/roland-system-500-531,https://www.roland.com/uk/products/system-500_531/features/,20,2018
Sputnik 6-Channel Stereo Mixer,6csm.jpg,Yes,6,0,30%,2,0,4 (manual),0,,Yes,$250,LED VU meters for master mix,https://www.modulargrid.net/e/sputnik-modular-6-channel-stereo-mixer,http://sputnik-modular.com/stereo-mixer/,20,2014
ST-Modular MIX & PAN,st-modular-mix-and-pan.jpg,Yes (DIY),4,0,22%,4,4,,,,No,TBD,variable width scanning with voltage control; LED level indicators per channel and per VCA,https://www.modulargrid.net/e/st-modular-sum-mix-pan-,https://www.st-modular.com/mixnpan.htm,18,2023
Steady State Fate Vortices,ssf-vortices.jpg,Yes,4 (plus 2 mono aux),3 (plus 1 stereo aux),39%,2 + crossfader,7,0,0,,No,$380,“tape simulation” signal coloring including build-in saturation and peak limiters; crossfader feature; stereo and mono mixer portions have their own outputs available; can be daisy-chained; expanders offer CV over the seven input levels and click-less muting,https://www.modulargrid.net/e/steady-state-fate-vortices,http://www.steadystatefate.com/vortices,18,2020
Strange Science Instruments M-4 Advanced Stereo Mixer,ssi.m-4.jpg,Yes,4,0,14%,4,4,0,0,,No,$700,variable gain switch for the VCAs,https://www.modulargrid.net/e/strange-science-instruments-m-4-advanced-stereo-mixer,http://www.strangesci.com/m4stereomixer/,28,2018
SynEssentials SE2026,synessentials-se2026.jpg,Yes,6,2 stereo returns,13%,0,0,6 (manual),2 mono sends,,Yes,$1500,low and high eq per channel; solo per channel; dual outs; dual stereo aux ins; note: all 1/4 jacks are stereo TRS except the two sends,https://www.modulargrid.net/e/other-unknown-se2026-6-channel-audio-mixer,http://www.hollandsynth.com,45,2020
Takaab Nearness,takaab-nearness.jpg,Yes,7,0,133%,0,0,0,0,,No,$50,the input jack you select corresponds to relative pan placement in the stereo field,https://www.modulargrid.net/e/takaab-nearness,https://www.siammodular.com/nearness-minimal-panning-mixer-eurorack-synthesizer-module,3,2018
Tesseract Tex-Mix,tesseract-mix.jpg,Yes (DIY or pre-built),4-8,0-4,25%,0,4,8 (manual),"2 mono sends, 2 stereo returns",,Yes,$250,expandable modular design (this is only one possible configuration); cue system; expander with direct outputs is available,https://www.modulargrid.net/e/tesseract-modular-tex-mix-master-section,,32,2019
Tiptop Audio 207t,tiptop-207t.jpg,Yes,6,1 stereo aux input,21%,2,0,6 (manual),0,,No,$270,stereo aux input; cue bus with two mono outputs; preamp section with 1/4-inch jack,https://modulargrid.net/e/tiptop-audio-buchla-207t,https://tiptopaudio.com/buchla/,28,2023
Toppobrillo MiniMix,toppobrillo-minimix.jpg,Yes,4-6,0-2,43%,2,0,6 (manual),0,,Yes,TBD,chainable,https://www.modulargrid.net/e/toppobrillo-minimix-silver-panel,,14,2021
Toppobrillo Stereomix,topobrillostereo.jpg,Discontinued,4,1 stereo AUX return,17%,4,4,4 (manual),"1 mono send, 1 stereo return",,Yes,$550,cv over AUX send for each channel; LED level indicators for master mix,https://www.modulargrid.net/e/toppobrillo-stereomix,http://www.toppobrillo.com/stereomix.html,24,2016
Toppobrillo Stereomix 2,topobrillostereo2.jpg,Discontinued,4,1 stereo AUX return,17%,4,4,4 (manual),"1 mono send, 1 stereo return",,Yes,$480,cv over AUX send for each channel; LED level indicators for master mix,https://www.modulargrid.net/e/toppobrillo-stereomix-2-black-panel,,24,2019
TouellSkouarn Kemmeskañ Mixer,touellskouarn-kemmeskan.jpg,Yes,4,2,7%,,,6 (manual),"2 mono sends, 1 master send/return",4,Yes,$1100,feedback and EQ features,https://modulargrid.net/e/touellskouarn-kemmeskan-mixer,https://touellskouarn.fr/,60,2024
Verbos Scan & Pan,scanpan.jpg,Yes,4,0,29%,4,4,0,0,,No,$400,variable width scanning with voltage control; LED level indicators per channel,https://www.modulargrid.net/e/verbos-electronics-scan-pan,http://www.verboselectronics.com/modules/,14,2015
Vostok Hive,vostok-hive.jpg,Yes,0-4,0-4,40%,4,0,,,,No,$250,master level control; master bus can be daisy chained between multiple units,https://modulargrid.net/e/vostok-instruments-hive,https://www.vostokinstruments.com/hive,10,2025
WMD Performance Mixer,wmdperfmixer.jpg,Discontinued,6,2,20%,8,8,0,2,"post-gain, pre-fader (requires DB25 expander)",Yes,$750,"6 mono channels, each with 2 switched inputs; 2 true stereo channels; 2 mono send/returns; one stereo insert; one end of chain stereo send/return, dual input buses; cueing system; various LED indicators; full headphone support; expanders add mute controls, two additional full stereo channels",https://www.modulargrid.net/e/wmd-performance-mixer-,http://www.wmdevices.com/collections/eurorack-modules/products/performance-mixer,40,2016
WMD Performance Mixer MkII,wmd-pm2.jpg,Yes,0-8,0-8,15%,8,8,manual/grouped,2 mono or stereo,pre- or post-fader (requires DB25 expander),Yes,$1500,CV over AUX; individual stereo channels can be switched to CV crossfaders for two mono signals; MIDI output for automation recording; CUE bus; modular channel design for easy repairs; balanced out option; LED VU meters; channel expanders available,https://doudoroff.com/mixers/,https://wmdevices.com/products/performance-mixer-mkii,52,2024
WMD PM Channels MkII,wmd-pmchannels2.jpg,Yes,0-4,0-4,22%,4,4,manual/grouped,2 mono or stereo,requires Performance Mixer MkII,No,$650,"While primarily a four channel expander for the Performance Mixer MkII, this module can also be used as a standalone stereo mixer with extensive CV control and two stereo sends",https://modulargrid.net/e/wmd-pm-channels-mkii,https://wmdevices.com/products/pm-channels-mkii,24,2024
Worng Sidecar,worng-sidecar.jpg,Yes,4,2,33%,0,6,0,0,,No,$360,inputs and outputs cascade to the right,https://modulargrid.net/e/worng-electronics-sidecar,https://www.worngelectronics.com/,18,2024
Worng Sound Stage,worng-soundstage.jpg,Discontinued,21,0,175%,0,0,0,0,,No,$350,the input jack you select corresponds horizontally to relative pan placement in the stereo field; vertical jack selection corresponds to EQ-like filtration (controlled overall manually or with CV); manual and CV-control over output level,https://www.modulargrid.net/e/worng-electronics-soundstage,https://www.worngelectronics.com,12,2018
Worng Sound Stage II,worng-soundstage-2.jpg,Yes,21,1 stereo return,150%,0,0,0,1 stereo master send/return,,No,$380,the input jack you select corresponds horizontally to relative pan placement in the stereo field; vertical jack selection corresponds to EQ-like filtration (controlled overall manually or with CV); manual and CV-control over output level; filtered effects send/return,https://www.modulargrid.net/e/worng-electronics-soundstage-ii,https://www.worngelectronics.com/,14,2023
XAOC Ostrawa,xaoc-ostrawa.jpg,Yes,0-4,0-4,20%,"4 (balance, not pan)",4,"4 (manual, CV with expander)","1 stereo send, 1 stereo return",,No,$560,individual LED VU meters per channel; Ostrawa and Praga units can be daisy chained with ribbon cables; Bohumin expander adds additional stereo send and return and cv-controlled muting,https://www.modulargrid.net/e/xaoc-devices-ostrawa,http://xaocdevices.com/main/ostrawa/,20,2023
XAOC Praga,praga.jpg,Yes,4,2 stereo returns,20%,4,4,"4 (manual, CV with expander)","2 mono sends, 2 stereo returns",4 (post-fader),No,$515,individual LED VU meters per channel;cv for each VCA switchable between unipolar and bipolar; Ostrawa and Praga units can be daisy chained with ribbon cables; HRAD expander adds additional CV and full master section,https://www.modulargrid.net/e/xaoc-devices-praga,http://xaocdevices.com/main/praga/,20,2017